{
  "schema_version": 1,
  "branch": "branch-cleanup-state-2026-09-29",
  "creator": "MaciejRucinskiVIMN",
  "last_commit_sha": "0a64d78a0c27733aa87f94c0dd4c9686b1504696",
  "last_commit_at": "2026-09-30T12:55:45Z",
  "candidate_reasons": [
    "stale_branch"
  ],
  "pull_request": null,
  "decision": "keep",
  "decision_source": "slack",
  "decided_at": "2026-10-01T14:05:24Z",
  "decided_by": null,
  "outcome": "pending",
  "archived_as": null,
  "deleted_at": null,
  "notes": "Vote: archive/keep (via Slack)"
}
