{
  "schema_version": 1,
  "branch": "exp2/already-gone",
  "creator": "MaciejRucinskiVIMN",
  "last_commit_sha": "0000000000000000000000000000000000000002",
  "last_commit_at": "2026-10-20T00:00:00Z",
  "candidate_reasons": [
    "stale_branch"
  ],
  "pull_request": null,
  "decision": "delete",
  "decision_source": "slack",
  "decided_at": "2026-10-15T10:00:00Z",
  "decided_by": null,
  "outcome": "skipped",
  "archived_as": null,
  "deleted_at": null,
  "notes": "Branch no longer exists in MaciejRucinskiVIMN/branch-cleanup-test-no-prod; nothing to delete."
}