{
  "schema_version": 1,
  "branch": "spike/graphql-gateway",
  "creator": "MaciejRucinskiVIMN",
  "last_commit_sha": "fd1d67b55cbae60fb234d8bd555d4d55e7ed23f4",
  "last_commit_at": "2026-07-21T08:41:57Z",
  "candidate_reasons": ["stale_pr"],
  "pull_request": {
    "number": 2,
    "title": "Spike: GraphQL gateway in front of the catalogue service",
    "url": "https://github.com/MaciejRucinskiVIMN/branch-cleanup-test-no-prod/pull/2",
    "draft": false,
    "base": "main",
    "last_activity_at": "2026-07-21T08:41:57Z",
    "closed_at": null
  },
  "decision": "undecided",
  "decision_source": null,
  "decided_at": null,
  "decided_by": null,
  "outcome": "pending",
  "archived_as": null,
  "deleted_at": null,
  "notes": "Branch is 70 days old, inside branch_stale_after_days; it is a candidate on the PR threshold alone."
}
