{
  "schema_version": 1,
  "branch": "branch-cleanup-state",
  "creator": "MaciejRucinskiVIMN",
  "last_commit_sha": "a3f46fe677cf08d184f3d2dc8019ad017a9a4d43",
  "last_commit_at": "2026-09-29T14:21:01Z",
  "candidate_reasons": [
    "stale_branch"
  ],
  "pull_request": null,
  "decision": "keep",
  "decision_source": "slack",
  "decided_at": "2026-09-30T15:37:41Z",
  "decided_by": null,
  "outcome": "pending",
  "archived_as": null,
  "deleted_at": null,
  "notes": "Vote: archive/keep (via Slack)"
}
