{
  "schema_version": 1,
  "branch": "exp2/delete-silence-pr",
  "creator": "MaciejRucinskiVIMN",
  "last_commit_sha": "4e0db43add99c50a4064e05fdf083ddc3fccc0fc",
  "last_commit_at": "2026-10-20T00:00:00Z",
  "candidate_reasons": [
    "stale_branch",
    "stale_pr"
  ],
  "pull_request": {
    "number": 7,
    "title": "exp2 PR",
    "url": "https://github.com/MaciejRucinskiVIMN/branch-cleanup-test-no-prod/pull/7",
    "draft": false,
    "base": "main",
    "last_activity_at": "2026-10-20T00:00:00Z",
    "closed_at": null
  },
  "decision": "delete",
  "decision_source": null,
  "decided_at": null,
  "decided_by": null,
  "outcome": "pending",
  "archived_as": null,
  "deleted_at": null,
  "notes": null
}
