{
  "schema_version": 1,
  "branch": "release/2026-q1",
  "creator": "MaciejRucinskiVIMN",
  "last_commit_sha": "0000000000000000000000000000000000000000",
  "last_commit_at": "2026-02-20T11:37:45Z",
  "candidate_reasons": [
    "stale_branch"
  ],
  "pull_request": null,
  "decision": "delete",
  "decision_source": "slack",
  "decided_at": "2026-10-15T10:00:00Z",
  "decided_by": null,
  "outcome": "pending",
  "archived_as": null,
  "deleted_at": null,
  "notes": "Fixture: stale sha, expect skipped (head moved)"
}
