{
  "schema_version": 1,
  "branch": "exp2/head-moved",
  "creator": "MaciejRucinskiVIMN",
  "last_commit_sha": "24120a97be02a2b0eb3c9c2abed7df0172ab6a57",
  "last_commit_at": "2026-10-20T00:00:00Z",
  "candidate_reasons": [
    "stale_branch"
  ],
  "pull_request": null,
  "decision": "delete",
  "decision_source": "slack",
  "decided_at": "2026-10-15T10:00:00Z",
  "decided_by": null,
  "outcome": "pending",
  "archived_as": null,
  "deleted_at": null,
  "notes": "Vote: delete (via Slack)"
}
