{
  "schema_version": 1,
  "branch": "chore/bump-eslint-config",
  "creator": "MaciejRucinskiVIMN",
  "last_commit_sha": "8b2fc32ead62cd333596ec46e50a195ee36904f1",
  "last_commit_at": "2026-01-08T16:13:04Z",
  "candidate_reasons": [
    "stale_branch"
  ],
  "pull_request": null,
  "decision": "keep",
  "decision_source": "slack",
  "decided_at": "2026-09-30T15:38:05Z",
  "decided_by": null,
  "outcome": "pending",
  "archived_as": null,
  "deleted_at": null,
  "notes": "Vote: archive/keep (via Slack)"
}
