{
  "schema_version": 1,
  "branch": "exp2/keep-plain",
  "creator": "MaciejRucinskiVIMN",
  "last_commit_sha": "06ce7c4aa5b671041f6ce4d8cd6bc1e96117b8ce",
  "last_commit_at": "2026-10-20T00:00:00Z",
  "candidate_reasons": [
    "stale_branch"
  ],
  "pull_request": null,
  "decision": "keep",
  "decision_source": "slack",
  "decided_at": "2026-10-15T10:00:00Z",
  "decided_by": null,
  "outcome": "pending",
  "archived_as": null,
  "deleted_at": null,
  "notes": "Vote: archive/keep (via Slack)"
}
