{
  "schema_version": 1,
  "branch": "exp3/keep-plain",
  "creator": "MaciejRucinskiVIMN",
  "last_commit_sha": "f269ce1c04b5f42fe7806d98f2959a0ed970499b",
  "last_commit_at": "2026-10-20T00:00:00Z",
  "candidate_reasons": [
    "stale_branch"
  ],
  "pull_request": null,
  "decision": "keep",
  "decision_source": "slack",
  "decided_at": "2026-10-15T10:00:00Z",
  "decided_by": null,
  "outcome": "archived",
  "archived_as": "archive/exp3/keep-plain",
  "deleted_at": null,
  "notes": "Kept by vote; renamed to archive/exp3/keep-plain."
}